{"schema_version":"as1.fusion.v1.2","satellite_id":"AS1","instrument_key":"COINBASE:BTCUSD","assembly_time":1785149100000,"fusion_status":"MIXED","visibility_score":72,"component_states":[{"layout_id":"HORUS_A","ticker_id":"COINBASE:BTCUSD","canonical_regime_id":"coinbase-btcusd-spot-regime-001","timeframe":"60","bar_close_time":1785148800000,"received_at":1785148801500,"age_seconds":300,"sensor_quality":"GOOD","freshness":"FRESH","valid":true,"dedup_key":"AS1|HORUS_A|coinbase-btcusd-spot-regime-001|60|1785148800000|as1.v1.2"},{"layout_id":"HORUS_B","ticker_id":"COINBASE:BTCUSD","canonical_regime_id":"coinbase-btcusd-spot-regime-001","timeframe":"60","bar_close_time":1785145200000,"received_at":1785145201500,"age_seconds":3900,"sensor_quality":"GOOD","freshness":"AGING","valid":true,"dedup_key":"AS1|HORUS_B|coinbase-btcusd-spot-regime-001|60|1785145200000|as1.v1.2"},{"layout_id":"MAAT","ticker_id":"COINBASE:BTCUSD","canonical_regime_id":"coinbase-btcusd-spot-regime-001","timeframe":"60","bar_close_time":1785148800000,"received_at":1785148801400,"age_seconds":300,"sensor_quality":"GOOD","freshness":"FRESH","valid":true,"dedup_key":"AS1|MAAT|coinbase-btcusd-spot-regime-001|60|1785148800000|as1.v1.2"}],"stale_layouts":[],"conflicting_layouts":[],"missing_layouts":["MAAT2"]}
